{
    "fmus": {
        "{msd1}": "fmus/MassSpringDamper1.fmu",
        "{msd2}": "fmus/MassSpringDamper2.fmu"
    },
    "connections": {
        "{msd1}.msd1i.x1": ["{msd2}.msd2i.x1"],
        "{msd1}.msd1i.v1": ["{msd2}.msd2i.v1"]
    },
    "logVariables": {
        "{msd2}.msd2i": ["x2", "v2"]
    },
    "parameters": {
        "{msd2}.msd2i.c2": 1.0,
        "{msd2}.msd2i.cc": 1.0,
        "{msd2}.msd2i.d2": 1.0,
        "{msd2}.msd2i.dc": 1.0,
        "{msd2}.msd2i.m2": 1.0
    },
    "algorithm": {
        "type": "fixed-step",
        "size": 0.001
    },
    "loggingOn": false,
    "overrideLogLevel": "INFO",
    "startTime": 0,
    "endTime": 10
}
